<?xml version="1.0" encoding="UTF-8"?>
<xs:schema xmlns:xs="http://www.w3.org/2001/XMLSchema" elementFormDefault="qualified"
  xmlns:oscal="http://csrc.nist.gov/ns/oscal/1.0"
  xmlns:m="http://csrc.nist.gov/ns/oscal/metaschema/1.0"
  targetNamespace="http://csrc.nist.gov/ns/oscal/metaschema/1.0">

  <!-- Import any OSCAL schemas needed for samples... -->
  <!--<xs:import namespace="http://csrc.nist.gov/ns/oscal/1.0"
    schemaLocation="../../../schema/xml/oscal-catalog-schema.xsd"/>-->
  <xs:element name="METASCHEMA">
    <xs:complexType>
      
      <xs:sequence>
        <xs:element ref="m:schema-name"/>
        <xs:element ref="m:short-name"/>
        <xs:element ref="m:namespace" minOccurs="1"/>
        <xs:element ref="m:remarks" minOccurs="0"/>
        <xs:element ref="m:import"  minOccurs="0" maxOccurs="unbounded"/>
        <xs:choice maxOccurs="unbounded">
          <xs:element ref="m:define-assembly"/>
          <xs:element ref="m:define-field"/>
          <xs:element ref="m:define-flag"/>
        </xs:choice>
      </xs:sequence>
      <xs:attribute name="root" use="required" type="xs:NCName"/>
    </xs:complexType>
  </xs:element>
  <xs:element name="define-assembly">
    <xs:complexType>
      <xs:sequence>
        <xs:element minOccurs="0" maxOccurs="unbounded" ref="m:flag"/>
        <xs:element minOccurs="0" ref="m:formal-name"/>
        <xs:element minOccurs="0" ref="m:description"/>
        <xs:element minOccurs="0" ref="m:remarks"/>

        <xs:element name="model" minOccurs="0">
          <xs:complexType>
            <xs:sequence>
              <xs:choice minOccurs="0" maxOccurs="unbounded">
                <xs:element ref="m:assembly"/>
                <xs:element ref="m:assemblies"/>
                <xs:element ref="m:field"/>
                <xs:element ref="m:fields"/>
                <xs:element ref="m:choice"/>
                <xs:element ref="m:prose"/>
              </xs:choice>
              <xs:element ref="m:any" minOccurs="0"/>
            </xs:sequence>
          </xs:complexType>
        </xs:element>

        <xs:element minOccurs="0" maxOccurs="unbounded" ref="m:example"/>
      </xs:sequence>
      <xs:attribute name="address" type="xs:NCName"/>
      <xs:attribute name="group-as" type="xs:NCName"/>
      <xs:attribute name="name" use="required" type="xs:NCName"/>
      <xs:attribute name="show-docs"/>
      <xs:attribute name="acquire-from" type="xs:NCName"/>
    </xs:complexType>
  </xs:element>
  <xs:element name="define-field">
    <xs:complexType>
      <xs:sequence>
        <xs:element minOccurs="0" maxOccurs="unbounded" ref="m:flag"/>
        <xs:element minOccurs="0" ref="m:formal-name"/>
        <xs:element minOccurs="0" ref="m:description"/>
        <xs:element minOccurs="0" ref="m:remarks"/>
        <xs:element minOccurs="0" maxOccurs="unbounded" ref="m:example"/>
      </xs:sequence>
      <xs:attribute name="as">
        
          <xs:simpleType>
            <xs:restriction base="xs:string">
              <xs:enumeration value="boolean" />
              <xs:enumeration value="empty" />
              <xs:enumeration value="string" />
              <xs:enumeration value="mixed" />
            </xs:restriction>
          </xs:simpleType>
        
      </xs:attribute>
      <xs:attribute name="group-as" type="xs:NCName"/>
      <xs:attribute name="name" use="required" type="xs:NCName"/>
      <xs:attribute name="show-docs"/>
      <xs:attribute name="acquire-from" type="xs:NCName"/>
    </xs:complexType>
  </xs:element>
  <xs:element name="define-flag">
    <xs:complexType>
      <xs:sequence>
        <xs:element minOccurs="0" ref="m:formal-name"/>
        <xs:element minOccurs="0" ref="m:description"/>
        <xs:element minOccurs="0" ref="m:remarks"/>
        <xs:element minOccurs="0" maxOccurs="unbounded" ref="m:example"/>
      </xs:sequence>
      <xs:attribute name="datatype" use="required" type="xs:NCName"/>
      <xs:attribute name="name" use="required" type="xs:NCName"/>
      <xs:attribute name="show-docs">
        <xs:simpleType>
          <xs:restriction base="xs:string">
            <xs:enumeration value="xml" />
            <xs:enumeration value="json" />
            <xs:enumeration value="xml json" />
          </xs:restriction>
        </xs:simpleType>
      </xs:attribute>
      <xs:attribute name="acquire-from" type="xs:NCName"/>
    </xs:complexType>
  </xs:element>
  <xs:element name="formal-name" type="xs:string"/>
  <xs:element name="namespace"   type="xs:anyURI"/>
  <xs:element name="description">
    <xs:complexType mixed="true">
      <xs:choice maxOccurs="unbounded">
        <xs:element minOccurs="0" maxOccurs="unbounded" ref="m:a"/>
        <xs:element minOccurs="0" maxOccurs="unbounded" ref="m:code"/>
        <xs:element minOccurs="0" maxOccurs="unbounded" ref="m:q"/>
        <xs:element minOccurs="0" maxOccurs="unbounded" ref="m:em"/>
        <xs:element minOccurs="0" maxOccurs="unbounded" ref="m:strong"/>
      </xs:choice>
    </xs:complexType>
  </xs:element>
  <xs:element name="remarks">
    <xs:complexType>
      <xs:sequence>
        <xs:element maxOccurs="unbounded" ref="m:p"/>
      </xs:sequence>
    </xs:complexType>
  </xs:element>
  <xs:element name="title">
    <xs:complexType mixed="true">
      <xs:choice maxOccurs="unbounded">
        <xs:element minOccurs="0" maxOccurs="unbounded" ref="m:code"/>
        <xs:element minOccurs="0" maxOccurs="unbounded" ref="m:q"/>
      </xs:choice>
    </xs:complexType>
  </xs:element>
  <xs:element name="schema-name">
    <xs:complexType mixed="true">
      <xs:choice maxOccurs="unbounded">
        <xs:element minOccurs="0" maxOccurs="unbounded" ref="m:code"/>
        <xs:element minOccurs="0" maxOccurs="unbounded" ref="m:q"/>
      </xs:choice>
    </xs:complexType>
  </xs:element>
  <xs:element name="short-name">
    <xs:complexType mixed="true">
      <xs:choice maxOccurs="unbounded">
        <xs:element minOccurs="0" maxOccurs="unbounded" ref="m:code"/>
        <xs:element minOccurs="0" maxOccurs="unbounded" ref="m:q"/>
      </xs:choice>
    </xs:complexType>
  </xs:element>
  <xs:element name="import">
    <xs:complexType mixed="true">
      <xs:attribute name="href" type="xs:anyURI" use="required"/>
      <xs:attribute name="name" type="xs:NCName" use="required"/>
    </xs:complexType>
  </xs:element>
  <xs:element name="assembly">
    <xs:complexType>
      <xs:sequence>
        <xs:element minOccurs="0" ref="m:description"/>
        <xs:element minOccurs="0" ref="m:remarks"/>
      </xs:sequence>
      <xs:attribute name="named" use="required" type="xs:NCName"/>
    </xs:complexType>
  </xs:element>
  <xs:element name="assemblies">
    <xs:complexType>
      <xs:sequence>
        <xs:element minOccurs="0" ref="m:description"/>
        <xs:element minOccurs="0" ref="m:remarks"/>
      </xs:sequence>
      <xs:attribute name="address" type="xs:NCName"/>
      <xs:attribute name="group-as" use="required" type="xs:NCName"/>
      <xs:attribute name="named" use="required" type="xs:NCName"/>
    </xs:complexType>
  </xs:element>
  <xs:element name="field">
    <xs:complexType>
      <xs:sequence>
        <xs:element minOccurs="0" ref="m:description"/>
        <xs:element minOccurs="0" ref="m:remarks"/>
      </xs:sequence>
      <xs:attribute name="named" use="required" type="xs:NCName"/>
      <xs:attribute name="required" type="xs:NCName"/>
    </xs:complexType>
  </xs:element>
  <xs:element name="fields">
    <xs:complexType>
      <xs:sequence>
        <xs:element minOccurs="0" ref="m:description"/>
        <xs:element minOccurs="0" ref="m:remarks"/>
      </xs:sequence>
      <xs:attribute name="group-as" use="required" type="xs:NCName"/>
      <xs:attribute name="named" use="required" type="xs:NCName"/>
    </xs:complexType>
  </xs:element>
  
  <xs:element name="value">
    <xs:complexType mixed="true"/>
  </xs:element>
  <xs:element name="p">
    <xs:complexType mixed="true">
      <xs:choice maxOccurs="unbounded">
        <xs:element minOccurs="0" maxOccurs="unbounded" ref="m:a"/>
        <xs:element minOccurs="0" maxOccurs="unbounded" ref="m:code"/>
        <xs:element minOccurs="0" maxOccurs="unbounded" ref="m:q"/>
        <xs:element minOccurs="0" maxOccurs="unbounded" ref="m:em"/>
        <xs:element minOccurs="0" maxOccurs="unbounded" ref="m:strong"/>
      </xs:choice>
    </xs:complexType>
  </xs:element>
  <xs:element name="a">
    <xs:complexType mixed="true">
      <xs:attribute name="href"/>
    </xs:complexType>
  </xs:element>
  <xs:element name="q" type="xs:string"/>
  <xs:element name="code" type="xs:string"/>
  <xs:element name="em" type="xs:string"/>
  <xs:element name="strong" type="xs:string"/>
  <xs:element name="flag">
    <xs:complexType>
      <xs:sequence>
        <xs:element minOccurs="0" ref="m:description"/>
        <xs:element minOccurs="0" ref="m:remarks"/>
        <xs:element minOccurs="0" maxOccurs="unbounded" ref="m:value"/>
      </xs:sequence>
      <xs:attribute name="datatype" type="xs:NCName"/>
      <xs:attribute name="name" use="required" type="xs:NCName"/>
      <xs:attribute name="required" type="xs:NCName"/>
    </xs:complexType>
  </xs:element>
  <xs:element name="choice">
    <xs:complexType>
      <xs:choice maxOccurs="unbounded">
        <xs:element ref="m:field"/>
        <xs:element ref="m:fields"/>
        <xs:element ref="m:assembly"/>
        <xs:element ref="m:assemblies"/>
      </xs:choice>
    </xs:complexType>
  </xs:element>
  <xs:element name="prose"/>
  <xs:element name="any"/>
  <xs:element name="example">
    <xs:complexType>
      <xs:sequence>
      <xs:element minOccurs="0" ref="m:description"/>
      <xs:element minOccurs="0" ref="m:remarks"/>
      <xs:choice minOccurs="0">
        <xs:any namespace="##other" processContents="lax"/>
      </xs:choice>
    </xs:sequence>
      <xs:attribute name="href" type="xs:anyURI"/>
      <xs:attribute name="path" type="xs:string"/>
      
      
    </xs:complexType>
  </xs:element>
  
</xs:schema>
